{
  "meta": {
    "version": "0.4",
    "domain": "example_domain",
    "created": "YYYY-MM-DD",
    "purpose": "Define the core cognition of this domain.",
    "load_condition": "Always load when this domain is selected."
  },
  "axioms": [
    {
      "id": "AX-001",
      "one_sentence": "One core judgment principle that changes how the agent evaluates situations.",
      "full_statement": "A testable, domain-specific principle. Must be specific enough that two experts would agree on when it applies. Avoid slogans.",
      "why": "Explain what the agent would get wrong WITHOUT this axiom, and what it gets right WITH it."
    }
  ],
  "ontology": [
    {
      "id": "CON-001",
      "one_sentence": "Name one central concept the agent must distinguish.",
      "essence": "What this concept really means in this domain. Not a dictionary definition — the operational meaning.",
      "boundary": "What this concept is NOT. A real distinction the agent must not blur.",
      "trigger_signal": "Words, phrases, or situations that signal this concept is relevant."
    }
  ],
  "frameworks": [
    {
      "id": "FW-001",
      "name": "Example Framework",
      "when_to_use": "Specific condition or context where this framework applies.",
      "steps": ["Step 1: What to check first", "Step 2: How to proceed", "Step 3: How to conclude"]
    }
  ],
  "core_structure": [
    {
      "from": "Surface symptom or common mistake the agent makes without domain cognition",
      "to": "Deeper cause or correct judgment the agent should reach",
      "via": "The cognitive shift or diagnostic path that bridges the gap"
    }
  ],
  "stances": [
    "The domain's default position on an issue. A concise assertion the agent should bias toward.",
    "What the domain rejects. The position the agent should argue against by default."
  ]
}
