{
  "meta": {
    "version": "0.2",
    "domain": "speaking_basic",
    "created": "2026-05-17",
    "purpose": "Define the core cognition of speaking and presentation judgment: audience focus, structure, and delivery.",
    "load_condition": "Always load when preparing a talk, presentation, pitch, or public speaking engagement."
  },
  "axioms": [
    {
      "id": "AX-001",
      "one_sentence": "The audience's takeaway is the only measure of success.",
      "full_statement": "A talk succeeds only if the audience leaves with a clear, retrievable insight they didn't have before. If the speaker feels good but the audience remembers nothing, the talk failed. Everything — content, structure, delivery — must serve the audience's takeaway.",
      "why": "Speakers naturally optimize for their own comfort and perceived performance. Shifting the metric to audience takeaway flips every preparation decision."
    },
    {
      "id": "AX-002",
      "one_sentence": "One talk, one message.",
      "full_statement": "If the audience can only remember one thing, what should it be? Build the entire talk around that one message. Everything else — stories, data, examples — exists to make that one message land.",
      "why": "A talk with three messages delivers zero. The audience's working memory is limited, and the speaker's job is to respect that limit."
    },
    {
      "id": "AX-003",
      "one_sentence": "Structure before slides, argument before aesthetics.",
      "full_statement": "The logic of the talk must be complete before a single slide is made. A well-structured talk with hand-drawn visuals outperforms a poorly structured talk with beautiful slides.",
      "why": "Slides are a delivery tool, not a thinking tool. Making slides before structuring the argument produces presentations that look finished but say nothing."
    }
  ],
  "ontology": [
    {
      "id": "audience_takeaway",
      "one_sentence": "The single insight the audience should retain after the talk.",
      "essence": "A clear, memorable statement that changes the audience's understanding of something.",
      "boundary": "Not a topic, not a title, not a list of points. It is one sentence the audience should be able to repeat.",
      "trigger_signal": "The speaker describes the topic but cannot state the takeaway in one sentence."
    },
    {
      "id": "cognitive_opening",
      "one_sentence": "The moment the audience realizes the talk is about something that matters to them.",
      "essence": "A gap, surprise, or question that makes the audience lean forward. It creates the 'why should I listen?' answer in the first 60 seconds.",
      "boundary": "Not an introduction, not a greeting, not an agenda. It is the reason to care.",
      "trigger_signal": "The talk opens with 'Hello, my name is...' or 'Today I'll talk about...' — these are administrative, not cognitive."
    },
    {
      "id": "signal_to_noise",
      "one_sentence": "The ratio of content that serves the takeaway to content that does not.",
      "essence": "Every slide, sentence, and story either advances the takeaway or dilutes it. High signal-to-noise talks feel dense with value. Low ratio talks feel long regardless of actual duration.",
      "boundary": "Entertainment value is not noise if it serves engagement, but engagement without takeaway is just entertainment.",
      "trigger_signal": "Speaker says 'I have 40 slides for a 20-minute talk' or 'I need to cover everything.'"
    }
  ],
  "frameworks": [
    {
      "id": "FW-001",
      "name": "Hook-Line-Sinker",
      "when_to_use": "When structuring a talk from scratch.",
      "steps": [
        "Hook: Open with why the audience should care — a surprising fact, a question, a story.",
        "Line: Deliver the one message clearly and support it with evidence, examples, and stories.",
        "Sinker: Close by restating the message and giving the audience a concrete next step or new way of seeing."
      ]
    },
    {
      "id": "FW-002",
      "name": "Slide Test",
      "when_to_use": "When reviewing each slide before presenting.",
      "steps": [
        "Cover the slide title. Can the audience understand the slide's point from the content alone?",
        "If the audience reads the slide, will they stop listening to you? If yes, simplify or delay the reveal.",
        "Delete every bullet point that doesn't directly support the talk's one message."
      ]
    }
  ],
  "core_structure": [
    {
      "from": "Speaker's knowledge dump",
      "to": "Audience's single clear takeaway",
      "via": "Structured argument with evidence and stories, stripped of everything that doesn't serve the takeaway"
    }
  ],
  "stances": [
    {
      "id": "ST-001",
      "stance": "The audience's limited attention is the speaker's responsibility, not the audience's problem.",
      "anti_stance": "If the audience is bored, they should try harder to pay attention."
    },
    {
      "id": "ST-002",
      "stance": "Slides support the speaker; the speaker does not narrate slides.",
      "anti_stance": "Slides are the presentation. The speaker reads them aloud."
    }
  ]
}
