{
  "meta": {
    "version": "0.2",
    "domain": "writing_basic",
    "created": "2026-05-17",
    "purpose": "Define the core cognition of writing judgment: clarity, structure, and reader focus.",
    "load_condition": "Always load when writing, editing, or reviewing any text."
  },
  "axioms": [
    {
      "id": "AX-001",
      "one_sentence": "Clarity is the writer's only obligation.",
      "full_statement": "Every sentence must move the reader's understanding forward. If a sentence does not add clarity, it adds noise. The writer's first duty is not to impress, inform, or persuade — it is to be understood without effort.",
      "why": "Without this priority, writing becomes self-expression instead of communication. Readers do not read to decode the writer; they read to gain understanding."
    },
    {
      "id": "AX-002",
      "one_sentence": "Assume the reader is intelligent, busy, and skeptical.",
      "full_statement": "Write for someone who can understand complex ideas but has limited time and patience. Respect their intelligence by not over-explaining. Respect their time by being concise. Respect their skepticism by providing evidence, not claims.",
      "why": "Writing that assumes a patient or naive reader fails with real readers. Every unnecessary word costs attention."
    },
    {
      "id": "AX-003",
      "one_sentence": "Structure is the writer's invisible argument.",
      "full_statement": "The order of ideas is itself an argument about what matters most, what depends on what, and what the reader should conclude. Poor structure makes even true statements feel unconvincing.",
      "why": "Readers sense structural weakness before they identify it. Well-structured writing earns trust before the argument begins."
    }
  ],
  "ontology": [
    {
      "id": "reader_model",
      "one_sentence": "The specific imagined reader the writer is addressing.",
      "essence": "A concrete person with specific knowledge, concerns, and attention span — not a generic audience.",
      "boundary": "Not 'everyone,' 'the public,' or 'readers in general.' Writing that works for everyone works for no one.",
      "trigger_signal": "Writer uses 'we all know,' 'obviously,' or undefined jargon. The reader model is too vague."
    },
    {
      "id": "cognitive_load",
      "one_sentence": "The mental effort required to process a piece of writing.",
      "essence": "Every sentence, paragraph, and section demands cognitive resources from the reader. The writer's job is to minimize unnecessary load while preserving meaning.",
      "boundary": "Cognitive load is not about dumbing down. It is about removing obstacles to understanding.",
      "trigger_signal": "A sentence requires re-reading, or a paragraph introduces terminology without defining it."
    },
    {
      "id": "one_idea_rule",
      "one_sentence": "Each paragraph serves exactly one idea.",
      "essence": "If a paragraph introduces a second idea, it needs to become two paragraphs. This forces the writer to decide what each idea really is.",
      "boundary": "Exceptions exist for narrative flow, but structural clarity should only be sacrificed intentionally, not accidentally.",
      "trigger_signal": "A paragraph covers multiple topics or changes direction mid-sentence."
    }
  ],
  "frameworks": [
    {
      "id": "FW-001",
      "name": "Inversion Check",
      "when_to_use": "When a sentence feels unclear or bloated.",
      "steps": [
        "Identify the sentence you're unsure about.",
        "Ask: 'If the reader believes the opposite of what I intend, would this sentence prevent that?'",
        "If confusion is possible, rewrite until unambiguous.",
        "Remove every word that does not change the meaning."
      ]
    },
    {
      "id": "FW-002",
      "name": "Pyramid Structure",
      "when_to_use": "When organizing a piece longer than 3 paragraphs.",
      "steps": [
        "State the main point in one sentence at the top.",
        "Group supporting ideas into distinct sections.",
        "Within each section, put the conclusion first, then evidence, then reasoning.",
        "Check that every subsection answers a question raised by the section above it."
      ]
    }
  ],
  "core_structure": [
    {
      "from": "Vague idea or intuition",
      "to": "Reader understanding and conviction",
      "via": "Specific, testable sentences in logical order"
    }
  ],
  "stances": [
    {
      "id": "ST-001",
      "stance": "Writing exists to transfer understanding, not to perform intelligence.",
      "anti_stance": "Writing exists to impress readers with vocabulary or complexity."
    },
    {
      "id": "ST-002",
      "stance": "Every sentence must earn its place. Delete the rest.",
      "anti_stance": "More words signal more thoroughness."
    }
  ]
}
